aw_deep_link,description,product_name,aw_image_url,search_price,merchant_name,display_price,brand_name,colour,rrp_price,category_name,aw_product_id,merchant_product_id,merchant_image_url,merchant_category
https://www.awin1.com/pclick.php?p=10752978409&a=305691&m=2606,Nike Air Max Uptempo 94 hi-top trainers with Air Max cushioning to the heel offering the stability and lightweight cushioning that made the original a basketball staple.,Nike Mens Air Max 2 Uptempo 94 Trainers White/White/White,https://images2.productserve.com/?w=200&h=200&bg=white&trim=5&t=letterbox&url=ssl%3Aresources.mandmdirect.com%2FImages%2F_default%2Fn%2Fk%2F1%2Fnk12199_1_large.jpg&feedId=2606&k=fe20ac77473c632fff74a3438d228da9a6740f98,83.95,M and M Direct IE,GBP83.95,Nike,,137.95,Mens Footwear,10752978409,NK12199,https://resources.mandmdirect.com/Images/_default/n/k/1/nk12199_1_large.jpg,Mens|Trainers|Trainers
https://www.awin1.com/pclick.php?p=10752978413&a=305691&m=2606,Nike slip-on trainers with an engineered knit upper that stretches to deliver a sock-like fit  while its adjustable midfoot strap provides a locked-down feel.,Nike Womens Sock Dart Breathe Trainers White/White/Glacier Blue,https://images2.productserve.com/?w=200&h=200&bg=white&trim=5&t=letterbox&url=ssl%3Aresources.mandmdirect.com%2FImages%2F_default%2Fn%2Fk%2F1%2Fnk12276_1_large.jpg&feedId=2606&k=9323b85b3bf3edf94b26ea603668b00b5d5054a2,65.95,M and M Direct IE,GBP65.95,Nike,,119.95,Womens Footwear,10752978413,NK12276,https://resources.mandmdirect.com/Images/_default/n/k/1/nk12276_1_large.jpg,Womens|Trainers|Trainers
https://www.awin1.com/pclick.php?p=10752978415&a=305691&m=2606,Nike slip-on mid-cut trainers with a single seam Flyknit upper providing a sock-like fit which provides both stretch and support.,Nike Womens Gyakusou Free RN Motion Flyknit 2017 Trainers Sail/Black/Sail,https://images2.productserve.com/?w=200&h=200&bg=white&trim=5&t=letterbox&url=ssl%3Aresources.mandmdirect.com%2FImages%2F_default%2Fn%2Fk%2F1%2Fnk12258_1_large.jpg&feedId=2606&k=0dec100d2f75d8876e0a521fccc62f92288e8b5d,101.95,M and M Direct IE,GBP101.95,Nike,,155.95,Womens Footwear,10752978415,NK12258,https://resources.mandmdirect.com/Images/_default/n/k/1/nk12258_1_large.jpg,Womens|Trainers|Trainers
https://www.awin1.com/pclick.php?p=10752978419&a=305691&m=2606,Nike Mayfly Lite trainers complete with a ripstop textile upper perfect for both durability and lightweight comfort. Designed to fold flat for easier storage.,Nike Mens Mayfly Lite Breathe Trainers White/Pure Platinum/White/White,https://images2.productserve.com/?w=200&h=200&bg=white&trim=5&t=letterbox&url=ssl%3Aresources.mandmdirect.com%2FImages%2F_default%2Fn%2Fk%2F1%2Fnk12266_1_large.jpg&feedId=2606&k=0e425484a214d95aec19ef80cf5927b45243b912,59.95,M and M Direct IE,GBP59.95,Nike,,95.95,Mens Footwear,10752978419,NK12266,https://resources.mandmdirect.com/Images/_default/n/k/1/nk12266_1_large.jpg,Mens|Trainers|Trainers
https://www.awin1.com/pclick.php?p=10752978423&a=305691&m=2606,Nike featherweight form-fitting trainers with a breathable Flyknit upper which wraps your foot for a flexable  snug fit.,Nike Womens Air Sock Racer Ultra Flyknit Trainers Yellow Strike/Black/White,https://images2.productserve.com/?w=200&h=200&bg=white&trim=5&t=letterbox&url=ssl%3Aresources.mandmdirect.com%2FImages%2F_default%2Fn%2Fk%2F1%2Fnk12235_1_large.jpg&feedId=2606&k=5f327b1255fd31b029ee5f61762f02632f294b90,59.95,M and M Direct IE,GBP59.95,Nike,,113.95,Womens Footwear,10752978423,NK12235,https://resources.mandmdirect.com/Images/_default/n/k/1/nk12235_1_large.jpg,Womens|Trainers|Trainers
https://www.awin1.com/pclick.php?p=12449378947&a=305691&m=2606,Nike lace-up trainers offer breathable comfort and promotes natural motion.,Nike Mens Air Footscape Woven Nm Trainers Binary Blue/Black/Team Royal,https://images2.productserve.com/?w=200&h=200&bg=white&trim=5&t=letterbox&url=ssl%3Aresources.mandmdirect.com%2FImages%2F_default%2Fn%2Fk%2F1%2Fnk12193_1_large.jpg&feedId=2606&k=549bedee1b83e782f3d231f1b9a897d65f488b4f,77.95,M and M Direct IE,GBP77.95,Nike,,143.95,Mens Footwear,12449378947,NK12193,https://resources.mandmdirect.com/Images/_default/n/k/1/nk12193_1_large.jpg,Mens|Trainers|Trainers
https://www.awin1.com/pclick.php?p=5784854769&a=305691&m=2606,Nike Air Max Zero Trainers have a bootie inspired construction and sock like upper. The visible Max Air unit delivers a lightweight cushioned experience. 857661103,Nike Womens Air Max Zero Trainers Light Orewood Brown/Oatmeal/White,https://images2.productserve.com/?w=200&h=200&bg=white&trim=5&t=letterbox&url=ssl%3Aresources.mandmdirect.com%2FImages%2F_default%2Fn%2Fk%2F1%2Fnk12078_1_large.jpg&feedId=2606&k=e13fcd6a508551f097a78176be53b365512e6cd9,83.95,M and M Direct IE,GBP83.95,Nike,,119.95,Womens Footwear,5784854769,NK12078,https://resources.mandmdirect.com/Images/_default/n/k/1/nk12078_1_large.jpg,Womens|Trainers|Trainers
https://www.awin1.com/pclick.php?p=5784854777&a=305691&m=2606,Nike leather trainers with an elastic strap and rubber cage on the heel that delivers a classic Huarache look. 881100001,Nike Womens Air Huarache Run Ultra Si Trainers Black/Black-Ivory,https://images2.productserve.com/?w=200&h=200&bg=white&trim=5&t=letterbox&url=ssl%3Aresources.mandmdirect.com%2FImages%2F_default%2Fn%2Fk%2F1%2Fnk12036_1_large.jpg&feedId=2606&k=652f968ec482c3fdfcef8679d5035cdea0f021f0,63.95,M and M Direct IE,GBP63.95,Nike,,131.95,Womens Footwear,5784854777,NK12036,https://resources.mandmdirect.com/Images/_default/n/k/1/nk12036_1_large.jpg,Womens|Trainers|Trainers
https://www.awin1.com/pclick.php?p=5784854801&a=305691&m=2606,Nike Air Unlimited hi-top trainers with adjustable velcro straps to provide a personal fit.,Nike Mens Air Unlimited Trainers Palm Green/Legion Green,https://images2.productserve.com/?w=200&h=200&bg=white&trim=5&t=letterbox&url=ssl%3Aresources.mandmdirect.com%2FImages%2F_default%2Fn%2Fk%2F1%2Fnk11981_1_large.jpg&feedId=2606&k=4d7f364617f8053799853235678150773ddc9eab,74.95,M and M Direct IE,GBP74.95,Nike,,149.95,Mens Footwear,5784854801,NK11981,https://resources.mandmdirect.com/Images/_default/n/k/1/nk11981_1_large.jpg,Mens|Trainers|Trainers
https://www.awin1.com/pclick.php?p=5784854807&a=305691&m=2606,Nike slip-on trainers with an engineered upper that stretches to deliver a sock-like fit  while its adjustable midfoot strap provides a locked-down feel.,Nike Mens Sock Dart SE Trainers Max Orange/Wolf Grey/Black,https://images2.productserve.com/?w=200&h=200&bg=white&trim=5&t=letterbox&url=ssl%3Aresources.mandmdirect.com%2FImages%2F_default%2Fn%2Fk%2F1%2Fnk12088_1_large.jpg&feedId=2606&k=4ccd7c7b550390a0ad2d49e2f9066562d1be04b7,59.95,M and M Direct IE,GBP59.95,Nike,,119.95,Mens Footwear,5784854807,NK12088,https://resources.mandmdirect.com/Images/_default/n/k/1/nk12088_1_large.jpg,Mens|Trainers|Trainers
https://www.awin1.com/pclick.php?p=5784978059&a=305691&m=2606,Nike Air Tech Challenge slip on trainers with an adjustable midfoot strap for a locked down feel.,Nike Womens Air Tech Challenge XVII Trainers Black/Anthracite,https://images2.productserve.com/?w=200&h=200&bg=white&trim=5&t=letterbox&url=ssl%3Aresources.mandmdirect.com%2FImages%2F_default%2Fn%2Fk%2F1%2Fnk11980_1_large.jpg&feedId=2606&k=d273f924b4ed82fe7ee4123bea8b9ad7699afc1e,71.95,M and M Direct IE,GBP71.95,Nike,,137.95,Womens Footwear,5784978059,NK11980,https://resources.mandmdirect.com/Images/_default/n/k/1/nk11980_1_large.jpg,Womens|Trainers|Trainers
https://www.awin1.com/pclick.php?p=5784978061&a=305691&m=2606,Nike slip-on trainers with an engineered knit upper that stretches to deliver a sock-like fit  while its adjustable midfoot strap provides a locked-down feel.,Nike Womens Sock Dart Trainers Linen/White/Black,https://images2.productserve.com/?w=200&h=200&bg=white&trim=5&t=letterbox&url=ssl%3Aresources.mandmdirect.com%2FImages%2F_default%2Fn%2Fk%2F1%2Fnk12059_1_large.jpg&feedId=2606&k=f0ff0ced5a0bf1317000f89b6e79320830695ed0,58.95,M and M Direct IE,GBP58.95,Nike,,125.95,Womens Footwear,5784978061,NK12059,https://resources.mandmdirect.com/Images/_default/n/k/1/nk12059_1_large.jpg,Womens|Trainers|Trainers
https://www.awin1.com/pclick.php?p=5784978087&a=305691&m=2606,Nike Air lightweight lace-up low profile trainers with a neoprene bootie construction. Featuring an Air sole unit for excellent cushioning.,Nike Womens Air Huarache Run Ultra Si Trainers Oatmeal/Oatmeal Ivory Metallic,https://images2.productserve.com/?w=200&h=200&bg=white&trim=5&t=letterbox&url=ssl%3Aresources.mandmdirect.com%2FImages%2F_default%2Fn%2Fk%2F1%2Fnk12038_1_large.jpg&feedId=2606&k=56687557e564d950294953044cbb637e74ccc3b5,79.95,M and M Direct IE,GBP79.95,Nike,,131.95,Womens Footwear,5784978087,NK12038,https://resources.mandmdirect.com/Images/_default/n/k/1/nk12038_1_large.jpg,Womens|Trainers|Trainers
https://www.awin1.com/pclick.php?p=5784978101&a=305691&m=2606,Nike lace-up trainers offer breathable comfort and promotes natural motion.,Nike Mens Air Footscape Woven Nm Trainers Desert Ochre/Gold Dart/Off White/Desert Ochre,https://images2.productserve.com/?w=200&h=200&bg=white&trim=5&t=letterbox&url=ssl%3Aresources.mandmdirect.com%2FImages%2F_default%2Fn%2Fk%2F1%2Fnk11991_1_large.jpg&feedId=2606&k=afecee8106f1138d8f08ff19cc441355dc62db83,74.95,M and M Direct IE,GBP74.95,Nike,,155.95,Mens Footwear,5784978101,NK11991,https://resources.mandmdirect.com/Images/_default/n/k/1/nk11991_1_large.jpg,Mens|Trainers|Trainers
https://www.awin1.com/pclick.php?p=5784978103&a=305691&m=2606,Nike Air Footscape trainers promoting natural motion and breathability.,Nike Mens Air Footscape Nm Trainers Black/Summit White/Dark Grey,https://images2.productserve.com/?w=200&h=200&bg=white&trim=5&t=letterbox&url=ssl%3Aresources.mandmdirect.com%2FImages%2F_default%2Fn%2Fk%2F1%2Fnk12101_1_large.jpg&feedId=2606&k=b6d1dc1a7021a363c0ac3b25246917b67e91e485,59.95,M and M Direct IE,GBP59.95,Nike,,131.95,Mens Footwear,5784978103,NK12101,https://resources.mandmdirect.com/Images/_default/n/k/1/nk12101_1_large.jpg,Mens|Trainers|Trainers
https://www.awin1.com/pclick.php?p=5784978105&a=305691&m=2606,Nike Air Footscape trainers promoting natural motion and breathability.,Nike Mens Air Footscape Nm Trainers Legion Green/Summit White/Black,https://images2.productserve.com/?w=200&h=200&bg=white&trim=5&t=letterbox&url=ssl%3Aresources.mandmdirect.com%2FImages%2F_default%2Fn%2Fk%2F1%2Fnk12102_1_large.jpg&feedId=2606&k=7d28db0808a0cb55cf57fc84c36c4e56dfd6da7a,65.95,M and M Direct IE,GBP65.95,Nike,,131.95,Mens Footwear,5784978105,NK12102,https://resources.mandmdirect.com/Images/_default/n/k/1/nk12102_1_large.jpg,Mens|Trainers|Trainers
https://www.awin1.com/pclick.php?p=5784978107&a=305691&m=2606,Nike Air Max Uptempo 94 hi-top trainers with Air Max cushioning to the heel offering the stability and lightweight cushioning that made the original a basketball staple.,Nike Mens Air Max 2 Uptempo 94 All Star QS Trainers University Blue/White,https://images2.productserve.com/?w=200&h=200&bg=white&trim=5&t=letterbox&url=ssl%3Aresources.mandmdirect.com%2FImages%2F_default%2Fn%2Fk%2F1%2Fnk12115_1_large.jpg&feedId=2606&k=0974b2a8ff4cc2d43a34f2a85bdc3911b1a2e152,65.95,M and M Direct IE,GBP65.95,Nike,,137.95,Mens Footwear,5784978107,NK12115,https://resources.mandmdirect.com/Images/_default/n/k/1/nk12115_1_large.jpg,Mens|Trainers|Trainers
https://www.awin1.com/pclick.php?p=5784978109&a=305691&m=2606,Nike Air Max Uptempo 95 hi-top trainers with a full-length Air-Sole unit offering the stability and lightweight cushioning that made the original a basketball staple.,Nike Mens Air Max Uptempo 95 All Star QS Trainers University Blue/White,https://images2.productserve.com/?w=200&h=200&bg=white&trim=5&t=letterbox&url=ssl%3Aresources.mandmdirect.com%2FImages%2F_default%2Fn%2Fk%2F1%2Fnk12125_1_large.jpg&feedId=2606&k=9278b2532c71a1c61e45921a0e5cbb8e774ec9fd,71.95,M and M Direct IE,GBP71.95,Nike,,149.95,Mens Footwear,5784978109,NK12125,https://resources.mandmdirect.com/Images/_default/n/k/1/nk12125_1_large.jpg,Mens|Trainers|Trainers
https://www.awin1.com/pclick.php?p=12449351451&a=305691&m=2606,Nike slip-on trainers with an engineered knit upper that stretches to deliver a sock-like fit  while its adjustable midfoot strap provides a locked-down feel.,Nike Womens Sock Dart Breathe Trainers Pale Grey/Glacier Blue/White,https://images2.productserve.com/?w=200&h=200&bg=white&trim=5&t=letterbox&url=ssl%3Aresources.mandmdirect.com%2FImages%2F_default%2Fn%2Fk%2F1%2Fnk12275_1_large.jpg&feedId=2606&k=6a224ff2fdef9da54e270854afd88b6788cc516f,71.95,M and M Direct IE,GBP71.95,Nike,,119.95,Womens Footwear,12449351451,NK12275,https://resources.mandmdirect.com/Images/_default/n/k/1/nk12275_1_large.jpg,Womens|Trainers|Trainers
https://www.awin1.com/pclick.php?p=3850801177&a=305691&m=2606,Nike Air Zoom trainers ideal for everyday comfort. Complete with moulded leather fingers which integrate with the laces.,Nike Mens Air Zoom Spirimic Trainers Bamboo,https://images2.productserve.com/?w=200&h=200&bg=white&trim=5&t=letterbox&url=ssl%3Aresources.mandmdirect.com%2FImages%2F_default%2Fn%2Fk%2F1%2Fnk11986_1_large.jpg&feedId=2606&k=9e500f07c33d48257e7bcc625978556aa49557b6,71.95,M and M Direct IE,GBP71.95,Nike,,167.95,Mens Footwear,3850801177,NK11986,https://resources.mandmdirect.com/Images/_default/n/k/1/nk11986_1_large.jpg,Mens|Trainers|Trainers
https://www.awin1.com/pclick.php?p=3864759463&a=305691&m=2606,Nike FCSM Spartak Moscow Away three pack football socks.,Nike Mens Three Pack FCSM Spartak Moscow Away Socks White/Red/Medium Grey,https://images2.productserve.com/?w=200&h=200&bg=white&trim=5&t=letterbox&url=ssl%3Aresources.mandmdirect.com%2FImages%2F_default%2Fn%2Fk%2F1%2Fnk11969_1_large.jpg&feedId=2606&k=bb49d74d308afe2229e75987b41b667f67c43aeb,5.95,M and M Direct IE,GBP5.95,Nike,,14.95,Socks & Hosiery,3864759463,NK11969,https://resources.mandmdirect.com/Images/_default/n/k/1/nk11969_1_large.jpg,Mens|Sports Socks|Football Socks
https://www.awin1.com/pclick.php?p=10752978393&a=305691&m=2606,Nike slip-on trainers with an engineered knit upper that stretches to deliver a sock-like fit  while its adjustable midfoot strap provides a locked-down feel.,Nike Mens Sock Dart Trainers Khaki/Cargo Khaki/White,https://images2.productserve.com/?w=200&h=200&bg=white&trim=5&t=letterbox&url=ssl%3Aresources.mandmdirect.com%2FImages%2F_default%2Fn%2Fk%2F1%2Fnk12272_1_large.jpg&feedId=2606&k=4fb0c8ffebfef8413588563446313ea42b7b91b8,71.95,M and M Direct IE,GBP71.95,Nike,,113.95,Mens Footwear,10752978393,NK12272,https://resources.mandmdirect.com/Images/_default/n/k/1/nk12272_1_large.jpg,Mens|Trainers|Trainers
https://www.awin1.com/pclick.php?p=10752978401&a=305691&m=2606,Nike lace-up trainers with classic Air Max visible Air unit in the sole that made it an icon.,Nike Womens Air Max Zero Metallic Gold Qs Trainers Metallic Gold/Metallic Gold/Varsity Red,https://images2.productserve.com/?w=200&h=200&bg=white&trim=5&t=letterbox&url=ssl%3Aresources.mandmdirect.com%2FImages%2F_default%2Fn%2Fk%2F1%2Fnk12223_1_large.jpg&feedId=2606&k=f132f0c12236fca4f0aaf7a54aae0ac5b74c5e30,101.95,M and M Direct IE,GBP101.95,Nike,,137.95,Womens Footwear,10752978401,NK12223,https://resources.mandmdirect.com/Images/_default/n/k/1/nk12223_1_large.jpg,Womens|Trainers|Trainers
https://www.awin1.com/pclick.php?p=10752978411&a=305691&m=2606,Nike Air Shake Ndestrukt trainers  a revival of the original basketball shoes keeping the signature asymmetrical profile.,Nike Mens Air Shake Ndestrukt Trainers White/Black/White,https://images2.productserve.com/?w=200&h=200&bg=white&trim=5&t=letterbox&url=ssl%3Aresources.mandmdirect.com%2FImages%2F_default%2Fn%2Fk%2F1%2Fnk12231_1_large.jpg&feedId=2606&k=6add389e3a8e1fcb2e51d163e0657987b9e0208c,65.95,M and M Direct IE,GBP65.95,Nike,,131.95,Mens Footwear,10752978411,NK12231,https://resources.mandmdirect.com/Images/_default/n/k/1/nk12231_1_large.jpg,Mens|Trainers|Trainers
https://www.awin1.com/pclick.php?p=10752978417&a=305691&m=2606,Nike slip-on trainers with an engineered knit upper that stretches to deliver a sock-like fit  while its adjustable midfoot strap provides a locked-down feel.,Nike Womens Sock Dart Trainers White/Pure Platinum,https://images2.productserve.com/?w=200&h=200&bg=white&trim=5&t=letterbox&url=ssl%3Aresources.mandmdirect.com%2FImages%2F_default%2Fn%2Fk%2F1%2Fnk12269_1_large.jpg&feedId=2606&k=cd4b641257061b9a05e7acb7caf99cbb9bad3fa8,77.95,M and M Direct IE,GBP77.95,Nike,,113.95,Womens Footwear,10752978417,NK12269,https://resources.mandmdirect.com/Images/_default/n/k/1/nk12269_1_large.jpg,Womens|Trainers|Trainers
https://www.awin1.com/pclick.php?p=3868507847&a=305691&m=2606,Nike Air Max Zero Trainers have a bootie inspired construction and sock like upper. The visible Max Air unit delivers a lightweight cushioned experience.,Nike Womens Air Max Zero Si Trainers Oatmeal/Binary Blue/White,https://images2.productserve.com/?w=200&h=200&bg=white&trim=5&t=letterbox&url=ssl%3Aresources.mandmdirect.com%2FImages%2F_default%2Fn%2Fk%2F1%2Fnk12087_1_large.jpg&feedId=2606&k=9ab3cde834f2cc4b6e701e241af2eecae4fcf41a,65.95,M and M Direct IE,GBP65.95,Nike,,131.95,Womens Footwear,3868507847,NK12087,https://resources.mandmdirect.com/Images/_default/n/k/1/nk12087_1_large.jpg,Womens|Trainers|Trainers
https://www.awin1.com/pclick.php?p=8995364029&a=305691&m=2606,Nike football socks. 406484105,Nike Mens FCZ Zenit St Petersburg Home Socks White,https://images2.productserve.com/?w=200&h=200&bg=white&trim=5&t=letterbox&url=ssl%3Aresources.mandmdirect.com%2FImages%2F_default%2Fn%2Fk%2F1%2Fnk12100_1_large.jpg&feedId=2606&k=ca771647468431d873d603dab2aa55a22e5cac97,3.95,M and M Direct IE,GBP3.95,Nike,,14.95,Socks & Hosiery,8995364029,NK12100,https://resources.mandmdirect.com/Images/_default/n/k/1/nk12100_1_large.jpg,Mens|Sports Socks|Football Socks
https://www.awin1.com/pclick.php?p=9073096155&a=305691&m=2606,Nike Air Force 1 mid-cut trainers with a Flyknit technology with integrated areas of breathability  stretch and support for a snug and adaptive fit.,Nike Womens Air Force 1 Flyknit Trainers White/Black,https://images2.productserve.com/?w=200&h=200&bg=white&trim=5&t=letterbox&url=ssl%3Aresources.mandmdirect.com%2FImages%2F_default%2Fn%2Fk%2F1%2Fnk11997_1_large.jpg&feedId=2606&k=cc1d3c68a166996717bb3d7fe6e7074be47512de,95.95,M and M Direct IE,GBP95.95,Nike,,137.95,Womens Footwear,9073096155,NK11997,https://resources.mandmdirect.com/Images/_default/n/k/1/nk11997_1_large.jpg,Womens|Trainers|Hi-Tops
https://www.awin1.com/pclick.php?p=10204057031&a=305691&m=2606,Nike Hyperdunk 2016 basketball trainers with built in Zoom Air cushioning. 844363060,Nike Mens Hyperdunk 2016 Low Trainers Black/Dark Grey/University Red,https://images2.productserve.com/?w=200&h=200&bg=white&trim=5&t=letterbox&url=ssl%3Aresources.mandmdirect.com%2FImages%2F_default%2Fn%2Fk%2F1%2Fnk12140_1_large.jpg&feedId=2606&k=7c231746fefef17605791e2ce6262bef8014da52,77.95,M and M Direct IE,GBP77.95,Nike,,131.95,Mens Footwear,10204057031,NK12140,https://resources.mandmdirect.com/Images/_default/n/k/1/nk12140_1_large.jpg,Mens|Trainers|Trainers
https://www.awin1.com/pclick.php?p=10752978379&a=305691&m=2606,Nike featherweight form-fitting trainers with a breathable Flyknit upper which wraps your foot for a flexable  snug fit.,Nike Womens Air Sock Racer Ultra Flyknit Trainers Black/White/White,https://images2.productserve.com/?w=200&h=200&bg=white&trim=5&t=letterbox&url=ssl%3Aresources.mandmdirect.com%2FImages%2F_default%2Fn%2Fk%2F1%2Fnk12234_1_large.jpg&feedId=2606&k=89c3aa0bb78fd1f816360ca24a0209cb9ad2d4c2,77.95,M and M Direct IE,GBP77.95,Nike,,113.95,Womens Footwear,10752978379,NK12234,https://resources.mandmdirect.com/Images/_default/n/k/1/nk12234_1_large.jpg,Womens|Trainers|Trainers
https://www.awin1.com/pclick.php?p=10752978381&a=305691&m=2606,Nike Air Unlimited hi-top trainers with adjustable velcro straps to provide a personal fit.,Nike Mens Air Unlimited Trainers Black/Slate/Ultramarine/White,https://images2.productserve.com/?w=200&h=200&bg=white&trim=5&t=letterbox&url=ssl%3Aresources.mandmdirect.com%2FImages%2F_default%2Fn%2Fk%2F1%2Fnk12238_1_large.jpg&feedId=2606&k=08c8f5a27f45ba1107a18921bd7ccb7c1ba4eb03,83.95,M and M Direct IE,GBP83.95,Nike,,149.95,Mens Footwear,10752978381,NK12238,https://resources.mandmdirect.com/Images/_default/n/k/1/nk12238_1_large.jpg,Mens|Trainers|Trainers
https://www.awin1.com/pclick.php?p=10752978395&a=305691&m=2606,Nike slip-on trainers with a breathable Flyknit upper and a synthetic midfoot strap for support.,Nike Womens City Knife 3 Flyknit Trainers White/Pure Platinum/Glacier Blue/Racer Pink,https://images2.productserve.com/?w=200&h=200&bg=white&trim=5&t=letterbox&url=ssl%3Aresources.mandmdirect.com%2FImages%2F_default%2Fn%2Fk%2F1%2Fnk12249_1_large.jpg&feedId=2606&k=2d416ac5c189659eb7fbefa715da3555c0c41e07,71.95,M and M Direct IE,GBP71.95,Nike,,143.95,Womens Footwear,10752978395,NK12249,https://resources.mandmdirect.com/Images/_default/n/k/1/nk12249_1_large.jpg,Womens|Trainers|Trainers
https://www.awin1.com/pclick.php?p=11250705521&a=305691&m=2606,Nike Air Max Uptempo 95 hi-top trainers with Air Max cushioning offering the stability and lightweight cushioning that made the original a basketball staple.,Nike Mens Air Max Uptempo 95 Trainers White/White/White,https://images2.productserve.com/?w=200&h=200&bg=white&trim=5&t=letterbox&url=ssl%3Aresources.mandmdirect.com%2FImages%2F_default%2Fn%2Fk%2F1%2Fnk12222_1_large.jpg&feedId=2606&k=908e98ace39976e45c521e885ea6ff4ca9f17806,89.95,M and M Direct IE,GBP89.95,Nike,,137.95,Mens Footwear,11250705521,NK12222,https://resources.mandmdirect.com/Images/_default/n/k/1/nk12222_1_large.jpg,Mens|Trainers|Trainers
https://www.awin1.com/pclick.php?p=12449351435&a=305691&m=2606,Nike Air Max Thea Ultra trainers complete with a Flyknit upper providing breathable support and a sock-like fit.,Nike Womens Air Max Thea Ultra Flyknit Trainers Light Armoury Blue/White/Glacier Blue/Work Blue,https://images2.productserve.com/?w=200&h=200&bg=white&trim=5&t=letterbox&url=ssl%3Aresources.mandmdirect.com%2FImages%2F_default%2Fn%2Fk%2F1%2Fnk12219_1_large.jpg&feedId=2606&k=46862a3fa6dc38df6a2b781d0e31ef1b4ebfe007,89.95,M and M Direct IE,GBP89.95,Nike,,131.95,Womens Footwear,12449351435,NK12219,https://resources.mandmdirect.com/Images/_default/n/k/1/nk12219_1_large.jpg,Womens|Trainers|Trainers
https://www.awin1.com/pclick.php?p=10752978383&a=305691&m=2606,Nike Air Shake Ndestrukt trainers  a revival of the original basketball shoes keeping the signature asymmetrical profile.,Nike Mens Air Shake Ndestrukt Trainers Black/White/Orange,https://images2.productserve.com/?w=200&h=200&bg=white&trim=5&t=letterbox&url=ssl%3Aresources.mandmdirect.com%2FImages%2F_default%2Fn%2Fk%2F1%2Fnk12230_1_large.jpg&feedId=2606&k=920244dc6d11dc54bfa417c86227559320a181e6,71.95,M and M Direct IE,GBP71.95,Nike,,131.95,Mens Footwear,10752978383,NK12230,https://resources.mandmdirect.com/Images/_default/n/k/1/nk12230_1_large.jpg,Mens|Trainers|Trainers
https://www.awin1.com/pclick.php?p=12449351465&a=305691&m=2606,Nike Air Max 90 lace-less trainers.,Nike Womens Air Max 90 Ultra 2.0 Ease Trainers White/Black/Dusted Clay,https://images2.productserve.com/?w=200&h=200&bg=white&trim=5&t=letterbox&url=ssl%3Aresources.mandmdirect.com%2FImages%2F_default%2Fn%2Fk%2F1%2Fnk12209_1_large.jpg&feedId=2606&k=385691345728eb28422f1c9afb40d4616018c167,83.95,M and M Direct IE,GBP83.95,Nike,,143.95,Womens Footwear,12449351465,NK12209,https://resources.mandmdirect.com/Images/_default/n/k/1/nk12209_1_large.jpg,Womens|Trainers|Trainers
https://www.awin1.com/pclick.php?p=3854697501&a=305691&m=2606,Nike football socks with slip reducing cushioning.,Nike Mens Park IV Football Socks Varsity Red/White,https://images2.productserve.com/?w=200&h=200&bg=white&trim=5&t=letterbox&url=ssl%3Aresources.mandmdirect.com%2FImages%2F_default%2Fn%2Fk%2F1%2Fnk11974_1_large.jpg&feedId=2606&k=23efec7fb2690a7cb6e365b1aed6d708a6a9e86b,1.95,M and M Direct IE,GBP1.95,Nike,,8.95,Socks & Hosiery,3854697501,NK11974,https://resources.mandmdirect.com/Images/_default/n/k/1/nk11974_1_large.jpg,Mens|Sports Socks|Football Socks
https://www.awin1.com/pclick.php?p=12449351467&a=305691&m=2606,Nike Free trainers with sock-like fit and moulded cage that wraps around your heel to keep it securely in place as you sprint  squat and lift.,Nike Womens Free TR 7 Trainers White/Metallic/Silver,https://images2.productserve.com/?w=200&h=200&bg=white&trim=5&t=letterbox&url=ssl%3Aresources.mandmdirect.com%2FImages%2F_default%2Fn%2Fk%2F1%2Fnk12255_1_large.jpg&feedId=2606&k=bdc7dda7c10b04836b61dda29a1ad6a3913fed8f,59.95,M and M Direct IE,GBP59.95,Nike,,101.95,Womens Footwear,12449351467,NK12255,https://resources.mandmdirect.com/Images/_default/n/k/1/nk12255_1_large.jpg,Womens|Trainers|Trainers
https://www.awin1.com/pclick.php?p=3872546693&a=305691&m=2606,Nike lace-up trainers featuring a lightweight combination upper for comfort and breathability and a low-profile design with an Air-Sole unit for excellent cushioning. 634835111,Nike Womens Air Huarache Run Trainers Oatmeal/Binary Blue/Lava Glow,https://images2.productserve.com/?w=200&h=200&bg=white&trim=5&t=letterbox&url=ssl%3Aresources.mandmdirect.com%2FImages%2F_default%2Fn%2Fk%2F1%2Fnk12024_1_large.jpg&feedId=2606&k=ea5a6503cf47e673a6222beab0e18f867399e44f,59.95,M and M Direct IE,GBP59.95,Nike,,107.95,Womens Footwear,3872546693,NK12024,https://resources.mandmdirect.com/Images/_default/n/k/1/nk12024_1_large.jpg,Womens|Trainers|Trainers
