aw_deep_link,description,product_name,aw_image_url,search_price,merchant_name,display_price,brand_name,colour,rrp_price,category_name,aw_product_id,merchant_product_id,merchant_image_url,merchant_category
https://www.awin1.com/pclick.php?p=5784854767&a=305691&m=2606,Nike Air Max Zero Trainers have a bootie inspired construction and sock like upper. The visible Max Air unit delivers a lightweight cushioned experience. 857661004,Nike Womens Air Max Zero Trainers Black/Black/Ivory,https://images2.productserve.com/?w=200&h=200&bg=white&trim=5&t=letterbox&url=ssl%3Aresources.mandmdirect.com%2FImages%2F_default%2Fn%2Fk%2F1%2Fnk12076_1_large.jpg&feedId=2606&k=e4e65fdaf35c66a8319724c9827680d6bb1ff0fc,53.95,M and M Direct IE,GBP53.95,Nike,,119.95,Womens Footwear,5784854767,NK12076,https://resources.mandmdirect.com/Images/_default/n/k/1/nk12076_1_large.jpg,Womens|Trainers|Trainers
https://www.awin1.com/pclick.php?p=12449351441&a=305691&m=2606,Nike slip-on trainers with a breathable Flyknit upper and a synthetic midfoot strap for support.,Nike Womens City Knife 3 Flyknit Trainers Racer Blue/Black,https://images2.productserve.com/?w=200&h=200&bg=white&trim=5&t=letterbox&url=ssl%3Aresources.mandmdirect.com%2FImages%2F_default%2Fn%2Fk%2F1%2Fnk12250_1_large.jpg&feedId=2606&k=73f5366545dee94137f015221a9e82fcd1df30c2,77.95,M and M Direct IE,GBP77.95,Nike,,143.95,Womens Footwear,12449351441,NK12250,https://resources.mandmdirect.com/Images/_default/n/k/1/nk12250_1_large.jpg,Womens|Trainers|Trainers
https://www.awin1.com/pclick.php?p=12449351437&a=305691&m=2606,Nike Air Zoom lace-up trainers that delivery lightweight  performance-inspired comfort in a sleek  everyday style.,Nike Mens Air Zoom LWP 16 SP Trainers Midnight Navy/Dark Obsidian,https://images2.productserve.com/?w=200&h=200&bg=white&trim=5&t=letterbox&url=ssl%3Aresources.mandmdirect.com%2FImages%2F_default%2Fn%2Fk%2F1%2Fnk12241_1_large.jpg&feedId=2606&k=0d237e1e5308e80d66f5f62b77bafd8c8a1ad461,71.95,M and M Direct IE,GBP71.95,Nike,,143.95,Mens Footwear,12449351437,NK12241,https://resources.mandmdirect.com/Images/_default/n/k/1/nk12241_1_large.jpg,Mens|Trainers|Trainers
https://www.awin1.com/pclick.php?p=12449378951&a=305691&m=2606,Nike lace-up trainers featuring sleek details and visible Max Air for all-day comfort.,Nike Womens Air Max Jewell Premium Trainers Pure Platinum/Metallic Silver/White/Pure Platinum,https://images2.productserve.com/?w=200&h=200&bg=white&trim=5&t=letterbox&url=ssl%3Aresources.mandmdirect.com%2FImages%2F_default%2Fn%2Fk%2F1%2Fnk12214_1_large.jpg&feedId=2606&k=0dbde66b80e9b4f589e24264f4047174b964589c,71.95,M and M Direct IE,GBP71.95,Nike,,101.95,Womens Footwear,12449378951,NK12214,https://resources.mandmdirect.com/Images/_default/n/k/1/nk12214_1_large.jpg,Womens|Trainers|Trainers
https://www.awin1.com/pclick.php?p=10204057015&a=305691&m=2606,Nike Air Unlimited hi-top trainers with adjustable velcro straps to provide a personal fit. 881204400,Nike Womens Air Unlimited Trainers Binary Blue/White/Gum,https://images2.productserve.com/?w=200&h=200&bg=white&trim=5&t=letterbox&url=ssl%3Aresources.mandmdirect.com%2FImages%2F_default%2Fn%2Fk%2F1%2Fnk12132_1_large.jpg&feedId=2606&k=d78e95e4c565c1ee505094b6af0e4bb970dc68d3,77.95,M and M Direct IE,GBP77.95,Nike,,149.95,Womens Footwear,10204057015,NK12132,https://resources.mandmdirect.com/Images/_default/n/k/1/nk12132_1_large.jpg,Womens|Trainers|Hi-Tops
https://www.awin1.com/pclick.php?p=3850801201&a=305691&m=2606,Nike slip-on trainers with a soft upper that surrounds your foot in comfort and just enough structure to add stability  with an adjustable midfoot strap provides a locked-down feel.,Nike Womens Sock Dart Premium Trainers Paramount Blue/White/Black,https://images2.productserve.com/?w=200&h=200&bg=white&trim=5&t=letterbox&url=ssl%3Aresources.mandmdirect.com%2FImages%2F_default%2Fn%2Fk%2F1%2Fnk12072_1_large.jpg&feedId=2606&k=d30f80ceede6fa3c6cacf9ffcc456e5668d144a8,51.95,M and M Direct IE,GBP51.95,Nike,,119.95,Womens Footwear,3850801201,NK12072,https://resources.mandmdirect.com/Images/_default/n/k/1/nk12072_1_large.jpg,Womens|Trainers|Trainers
https://www.awin1.com/pclick.php?p=3850801209&a=305691&m=2606,Nike slip-on trainers with a soft upper that surrounds your foot in comfort and just enough structure to add stability  with an adjustable midfoot strap provides a locked-down feel.,Nike Womens Sock Dart Premium Trainers Max Orange/White/Black,https://images2.productserve.com/?w=200&h=200&bg=white&trim=5&t=letterbox&url=ssl%3Aresources.mandmdirect.com%2FImages%2F_default%2Fn%2Fk%2F1%2Fnk12074_1_large.jpg&feedId=2606&k=aa8dd2d25baf43595a727eba58ca290045d27547,51.95,M and M Direct IE,GBP51.95,Nike,,119.95,Womens Footwear,3850801209,NK12074,https://resources.mandmdirect.com/Images/_default/n/k/1/nk12074_1_large.jpg,Womens|Trainers|Trainers
https://www.awin1.com/pclick.php?p=3850801211&a=305691&m=2606,Nike Air Zoom trainers ideal for everyday comfort. Complete with moulded leather fingers which integrate with the laces.,Nike Mens Air Zoom Spirimic Trainers Team Red,https://images2.productserve.com/?w=200&h=200&bg=white&trim=5&t=letterbox&url=ssl%3Aresources.mandmdirect.com%2FImages%2F_default%2Fn%2Fk%2F1%2Fnk11989_1_large.jpg&feedId=2606&k=1fbe4a638f15900111b641deb75ada3252b6e5c9,63.95,M and M Direct IE,GBP63.95,Nike,,167.95,Mens Footwear,3850801211,NK11989,https://resources.mandmdirect.com/Images/_default/n/k/1/nk11989_1_large.jpg,Mens|Trainers|Trainers
https://www.awin1.com/pclick.php?p=3872546675&a=305691&m=2606,Nike Mayfly suede trainers with a two-tone upper and soft Phylon foam underfoot. 816548100,Nike Mens Mayfly Leather Premium Trainers Off White/Smokey Blue,https://images2.productserve.com/?w=200&h=200&bg=white&trim=5&t=letterbox&url=ssl%3Aresources.mandmdirect.com%2FImages%2F_default%2Fn%2Fk%2F1%2Fnk12044_1_large.jpg&feedId=2606&k=d22beebc10e08695543245ae742bc279ab152218,51.95,M and M Direct IE,GBP51.95,Nike,,107.95,Mens Footwear,3872546675,NK12044,https://resources.mandmdirect.com/Images/_default/n/k/1/nk12044_1_large.jpg,Mens|Trainers|Trainers
https://www.awin1.com/pclick.php?p=3850801195&a=305691&m=2606,Nike slip-on trainers  built to beat bad weather featuring an innovative upper that deflects rain  holds in heat and stretches with every step. 881186001,Nike Womens Sock Dart Premium Trainers Black/White,https://images2.productserve.com/?w=200&h=200&bg=white&trim=5&t=letterbox&url=ssl%3Aresources.mandmdirect.com%2FImages%2F_default%2Fn%2Fk%2F1%2Fnk12070_1_large.jpg&feedId=2606&k=b8cb536227223d35176b42a2a60d35854c8efe90,53.95,M and M Direct IE,GBP53.95,Nike,,119.95,Womens Footwear,3850801195,NK12070,https://resources.mandmdirect.com/Images/_default/n/k/1/nk12070_1_large.jpg,Womens|Trainers|Trainers
https://www.awin1.com/pclick.php?p=3850801197&a=305691&m=2606,Nike Air Zoom trainers ideal for everyday comfort. Complete with moulded leather fingers which integrate with the laces. 881983401,Nike Mens Air Zoom Spirimic Trainers Loyal Blue,https://images2.productserve.com/?w=200&h=200&bg=white&trim=5&t=letterbox&url=ssl%3Aresources.mandmdirect.com%2FImages%2F_default%2Fn%2Fk%2F1%2Fnk11988_1_large.jpg&feedId=2606&k=72f2e2da38845a24c4139da69b5d20a1df1bfef4,67.95,M and M Direct IE,GBP67.95,Nike,,167.95,Mens Footwear,3850801197,NK11988,https://resources.mandmdirect.com/Images/_default/n/k/1/nk11988_1_large.jpg,Mens|Trainers|Trainers
https://www.awin1.com/pclick.php?p=5784978137&a=305691&m=2606,Nike Air Max Zero Trainers have a bootie inspired construction and sock like upper. The visible Max Air unit delivers a lightweight cushioned experience.,Nike Womens Air Max Zero Trainers Glacier Blue/Black/Ivory/Palm Green,https://images2.productserve.com/?w=200&h=200&bg=white&trim=5&t=letterbox&url=ssl%3Aresources.mandmdirect.com%2FImages%2F_default%2Fn%2Fk%2F1%2Fnk12127_1_large.jpg&feedId=2606&k=1a9137e0b66202279804332ca72ede25c6194539,59.95,M and M Direct IE,GBP59.95,Nike,,119.95,Womens Footwear,5784978137,NK12127,https://resources.mandmdirect.com/Images/_default/n/k/1/nk12127_1_large.jpg,Womens|Trainers|Trainers
https://www.awin1.com/pclick.php?p=10204057003&a=305691&m=2606,Nike Air Footscape trainers promoting natural motion and breathability. 913929001,Nike Mens Air Footscape Woven Chukka QS Trainers Anthracite/White/Black,https://images2.productserve.com/?w=200&h=200&bg=white&trim=5&t=letterbox&url=ssl%3Aresources.mandmdirect.com%2FImages%2F_default%2Fn%2Fk%2F1%2Fnk12103_1_large.jpg&feedId=2606&k=457e8decb9bc1d42eb94699cdc5f66804d489f91,107.95,M and M Direct IE,GBP107.95,Nike,,173.95,Mens Footwear,10204057003,NK12103,https://resources.mandmdirect.com/Images/_default/n/k/1/nk12103_1_large.jpg,Mens|Trainers|Trainers
https://www.awin1.com/pclick.php?p=10204057033&a=305691&m=2606,Nike Air Max lace-up trainers with full-length Max Air cushioning for complete comfort. 896495100,Nike Womens Air Max LD Zero Trainers White,https://images2.productserve.com/?w=200&h=200&bg=white&trim=5&t=letterbox&url=ssl%3Aresources.mandmdirect.com%2FImages%2F_default%2Fn%2Fk%2F1%2Fnk12121_1_large.jpg&feedId=2606&k=a3d4c35a5a122905ee2a3243e5c65bd44e722a56,107.95,M and M Direct IE,GBP107.95,Nike,,161.95,Womens Footwear,10204057033,NK12121,https://resources.mandmdirect.com/Images/_default/n/k/1/nk12121_1_large.jpg,Womens|Trainers|Trainers
https://www.awin1.com/pclick.php?p=12449378957&a=305691&m=2606,Nike extremely lightweight low profile running shoes with a Flyknit upper  designed to feel natural and weightless  similar to bare feet.,Nike Womens Gyakusou Free RN Flyknit 2017 Trainers Black/Sail/Black,https://images2.productserve.com/?w=200&h=200&bg=white&trim=5&t=letterbox&url=ssl%3Aresources.mandmdirect.com%2FImages%2F_default%2Fn%2Fk%2F1%2Fnk12257_1_large.jpg&feedId=2606&k=9e2ea82d01ad8d5b35b8d876de8997a4f21d98a7,95.95,M and M Direct IE,GBP95.95,Nike,,131.95,Womens Footwear,12449378957,NK12257,https://resources.mandmdirect.com/Images/_default/n/k/1/nk12257_1_large.jpg,Womens|Trainers|Trainers
https://www.awin1.com/pclick.php?p=12449378959&a=305691&m=2606,Nike Air Max 90 lace-less trainers.,Nike Womens Air Max 90 Ultra 2.0 Ease Trainers Black/White,https://images2.productserve.com/?w=200&h=200&bg=white&trim=5&t=letterbox&url=ssl%3Aresources.mandmdirect.com%2FImages%2F_default%2Fn%2Fk%2F1%2Fnk12208_1_large.jpg&feedId=2606&k=18d53f0c366478f3a5b5b798c829fccadff893c2,83.95,M and M Direct IE,GBP83.95,Nike,,143.95,Womens Footwear,12449378959,NK12208,https://resources.mandmdirect.com/Images/_default/n/k/1/nk12208_1_large.jpg,Womens|Trainers|Trainers
https://www.awin1.com/pclick.php?p=5784978133&a=305691&m=2606,Nike Air Max Zero Trainers have a bootie inspired construction and sock like upper. The visible Max Air unit delivers a lightweight cushioned experience.,Nike Womens Air Max Zero Si Trainers Glacier Blue/Legion Green/White/Black,https://images2.productserve.com/?w=200&h=200&bg=white&trim=5&t=letterbox&url=ssl%3Aresources.mandmdirect.com%2FImages%2F_default%2Fn%2Fk%2F1%2Fnk12129_1_large.jpg&feedId=2606&k=fd0a67769fd1fc7be838efac1b23e5469ef263e6,71.95,M and M Direct IE,GBP71.95,Nike,,131.95,Womens Footwear,5784978133,NK12129,https://resources.mandmdirect.com/Images/_default/n/k/1/nk12129_1_large.jpg,Womens|Trainers|Trainers
https://www.awin1.com/pclick.php?p=3670305453&a=305691&m=2606,Nike lightweight crossfit training gloves designed for agility and speed during cross-training exercises.,Nike Mens Lunatic Crossfit Training Gloves Black/Anthracite/Total Crimson,https://images2.productserve.com/?w=200&h=200&bg=white&trim=5&t=letterbox&url=ssl%3Aresources.mandmdirect.com%2FImages%2F_default%2Fn%2Fk%2F1%2Fnk11847_1_large.jpg&feedId=2606&k=7cdf7bdab522a87c04fc6f80591f40924597ac7a,16.95,M and M Direct IE,GBP16.95,Nike,,35.95,Mens Sportswear,3670305453,NK11847,https://resources.mandmdirect.com/Images/_default/n/k/1/nk11847_1_large.jpg,Mens|Sports Accessories|Gloves
https://www.awin1.com/pclick.php?p=3670305467&a=305691&m=2606,Nike portable push up grips helps to strengthen your chest  triceps and shoulders.,Nike Mens Push Up Grips 2.0 Grey/Black/Bright Crimson,https://images2.productserve.com/?w=200&h=200&bg=white&trim=5&t=letterbox&url=ssl%3Aresources.mandmdirect.com%2FImages%2F_default%2Fn%2Fk%2F1%2Fnk11851_1_large.jpg&feedId=2606&k=1f6268e02fbcab99cca2dd2a68e65260794e4ea2,11.95,M and M Direct IE,GBP11.95,Nike,,23.95,Mens Sportswear,3670305467,NK11851,https://resources.mandmdirect.com/Images/_default/n/k/1/nk11851_1_large.jpg,Mens|Sports Accessories|Gym Equipment
https://www.awin1.com/pclick.php?p=3670305473&a=305691&m=2606,Nike weight training gloves featuring perforated mesh to help keep your hands cool and an adjustable strap for a secure fit.,Nike Mens Core Lock Weight Training Gloves Flint Grey/Black/Game Royal,https://images2.productserve.com/?w=200&h=200&bg=white&trim=5&t=letterbox&url=ssl%3Aresources.mandmdirect.com%2FImages%2F_default%2Fn%2Fk%2F1%2Fnk11848_1_large.jpg&feedId=2606&k=1490140d0bb8cc4ab5028416d3001a6fee99e620,9.95,M and M Direct IE,GBP9.95,Nike,,17.95,Mens Sportswear,3670305473,NK11848,https://resources.mandmdirect.com/Images/_default/n/k/1/nk11848_1_large.jpg,Mens|Sports Accessories|Gloves
https://www.awin1.com/pclick.php?p=3670305501&a=305691&m=2606,Nike ankle sleeve.,Nike Mens Pro Ankle Sleeve 2.0 Compression Support Black/White,https://images2.productserve.com/?w=200&h=200&bg=white&trim=5&t=letterbox&url=ssl%3Aresources.mandmdirect.com%2FImages%2F_default%2Fn%2Fk%2F1%2Fnk11862_1_large.jpg&feedId=2606&k=ae136d22aa2aa38cb508f85eb377ec0f22c1d157,8.95,M and M Direct IE,GBP8.95,Nike,,11.95,Mens Sportswear,3670305501,NK11862,https://resources.mandmdirect.com/Images/_default/n/k/1/nk11862_1_large.jpg,Mens|Sports Accessories|Gym Equipment
https://www.awin1.com/pclick.php?p=3670305503&a=305691&m=2606,Nike thigh sleeve.,Nike Mens Pro Thigh Sleeve 2.0 Compression Support Black/White,https://images2.productserve.com/?w=200&h=200&bg=white&trim=5&t=letterbox&url=ssl%3Aresources.mandmdirect.com%2FImages%2F_default%2Fn%2Fk%2F1%2Fnk11860_1_large.jpg&feedId=2606&k=9ea0d6b62fb3936f65ae8e1f0b0a6721acb38432,10.95,M and M Direct IE,GBP10.95,Nike,,17.95,Mens Sportswear,3670305503,NK11860,https://resources.mandmdirect.com/Images/_default/n/k/1/nk11860_1_large.jpg,Mens|Sports Accessories|Gym Equipment
https://www.awin1.com/pclick.php?p=3670305509&a=305691&m=2606,Nike lightweight running armband featuring a clear durable window to keep your phone accessible and protected during your workout. Compatible with most smartphones including the Apple iPhone 6s (but not the 6 plus). Window measures 13x7cm approx.,Nike Mens Lightweight Running Arm Band 2.0 Black/Silver,https://images2.productserve.com/?w=200&h=200&bg=white&trim=5&t=letterbox&url=ssl%3Aresources.mandmdirect.com%2FImages%2F_default%2Fn%2Fk%2F1%2Fnk11838_1_large.jpg&feedId=2606&k=2af3834a38136a7b356655a1ce8569a274ff9667,14.95,M and M Direct IE,GBP14.95,Nike,,23.95,Mens Sportswear,3670305509,NK11838,https://resources.mandmdirect.com/Images/_default/n/k/1/nk11838_1_large.jpg,Mens|Sports Accessories|Gym Equipment
https://www.awin1.com/pclick.php?p=3872546667&a=305691&m=2606,Nike Air Unlimited hi-top trainers with adjustable velcro straps to provide a personal fit. 881204001,Nike Womens Air Unlimited Trainers Black/White/Gum/Light Brown,https://images2.productserve.com/?w=200&h=200&bg=white&trim=5&t=letterbox&url=ssl%3Aresources.mandmdirect.com%2FImages%2F_default%2Fn%2Fk%2F1%2Fnk11983_1_large.jpg&feedId=2606&k=1213ec8ac930291af88750c44eb2333d94c70648,63.95,M and M Direct IE,GBP63.95,Nike,,149.95,Womens Footwear,3872546667,NK11983,https://resources.mandmdirect.com/Images/_default/n/k/1/nk11983_1_large.jpg,Womens|Trainers|Trainers
https://www.awin1.com/pclick.php?p=10204057005&a=305691&m=2606,Nike Air Footscape mid-cut trainers promoting natural motion and breathability. 913929002,Nike Mens Air Footscape Woven Chukka QS Trainers Light Bone/Summit White,https://images2.productserve.com/?w=200&h=200&bg=white&trim=5&t=letterbox&url=ssl%3Aresources.mandmdirect.com%2FImages%2F_default%2Fn%2Fk%2F1%2Fnk12104_1_large.jpg&feedId=2606&k=fc01433ba24add6b6fd25f71551b4289c873932b,107.95,M and M Direct IE,GBP107.95,Nike,,173.95,Mens Footwear,10204057005,NK12104,https://resources.mandmdirect.com/Images/_default/n/k/1/nk12104_1_large.jpg,Mens|Trainers|Trainers
https://www.awin1.com/pclick.php?p=10204057021&a=305691&m=2606,Nike Mayfly suede trainers with a two-tone upper and soft Phylon foam underfoot.  816548300,Nike Mens Mayfly Leather PRM Trainers Legion Green/Black/Light Bone,https://images2.productserve.com/?w=200&h=200&bg=white&trim=5&t=letterbox&url=ssl%3Aresources.mandmdirect.com%2FImages%2F_default%2Fn%2Fk%2F1%2Fnk12151_1_large.jpg&feedId=2606&k=51736dddfe41747e003c7c45674298ae9286f4b0,65.95,M and M Direct IE,GBP65.95,Nike,,107.95,Mens Footwear,10204057021,NK12151,https://resources.mandmdirect.com/Images/_default/n/k/1/nk12151_1_large.jpg,Mens|Trainers|Trainers
https://www.awin1.com/pclick.php?p=10362579541&a=305691&m=2606,Nike lace-up trainers with Flyknit fabric to allow a natural snug fit that flexes with every movement.  81175600,Nike Womens Air Max Thea Flyknit Trainers Black/Bright Crimson/White/Wolf Grey,https://images2.productserve.com/?w=200&h=200&bg=white&trim=5&t=letterbox&url=ssl%3Aresources.mandmdirect.com%2FImages%2F_default%2Fn%2Fk%2F1%2Fnk12124_1_large.jpg&feedId=2606&k=829542c9c4fb4bd19766ab4e6904ddb751bfe47c,101.95,M and M Direct IE,GBP101.95,Nike,,131.95,Womens Footwear,10362579541,NK12124,https://resources.mandmdirect.com/Images/_default/n/k/1/nk12124_1_large.jpg,Womens|Trainers|Trainers
https://www.awin1.com/pclick.php?p=5784978081&a=305691&m=2606,Nike slip-on trainers with a soft upper that surrounds your foot in comfort and just enough structure to add stability.,Nike Womens Sock Dart SE Trainers Black/Blue Lagoon/White,https://images2.productserve.com/?w=200&h=200&bg=white&trim=5&t=letterbox&url=ssl%3Aresources.mandmdirect.com%2FImages%2F_default%2Fn%2Fk%2F1%2Fnk12077_1_large.jpg&feedId=2606&k=bdb9b207cb88115633ab1d25e88fd25b18a06506,65.95,M and M Direct IE,GBP65.95,Nike,,125.95,Womens Footwear,5784978081,NK12077,https://resources.mandmdirect.com/Images/_default/n/k/1/nk12077_1_large.jpg,Womens|Trainers|Trainers
https://www.awin1.com/pclick.php?p=5784978125&a=305691&m=2606,Nike Air Max Ultra 1 Ultra trainers with no-sew overlays for lightweight style. A special 30th anniversary edition.,Nike Womens Air Max 1 Ultra 2.0 Trainers White/Neutral Grey/Black/University Red,https://images2.productserve.com/?w=200&h=200&bg=white&trim=5&t=letterbox&url=ssl%3Aresources.mandmdirect.com%2FImages%2F_default%2Fn%2Fk%2F1%2Fnk12112_1_large.jpg&feedId=2606&k=64b4f0fa492c00f6f66681c4acc8e7d2d9ce5b0a,77.95,M and M Direct IE,GBP77.95,Nike,,137.95,Womens Footwear,5784978125,NK12112,https://resources.mandmdirect.com/Images/_default/n/k/1/nk12112_1_large.jpg,Womens|Trainers|Trainers
https://www.awin1.com/pclick.php?p=3671225075&a=305691&m=2606,Nike neck warmer.,Nike Mens Basic Neck Warmer Gaiter Black/White,https://images2.productserve.com/?w=200&h=200&bg=white&trim=5&t=letterbox&url=ssl%3Aresources.mandmdirect.com%2FImages%2F_default%2Fn%2Fk%2F1%2Fnk11864_1_large.jpg&feedId=2606&k=548437b2bef10d40391b5961ba36d2c4c80da3f5,8.95,M and M Direct IE,GBP8.95,Nike,,11.95,Mens Accessories,3671225075,NK11864,https://resources.mandmdirect.com/Images/_default/n/k/1/nk11864_1_large.jpg,Mens|Accessories|Scarves
https://www.awin1.com/pclick.php?p=3671225077&a=305691&m=2606,Nike neck warmer.,Nike Mens Basic Neck Warmer Gaiter Deep Royal Blue/Black,https://images2.productserve.com/?w=200&h=200&bg=white&trim=5&t=letterbox&url=ssl%3Aresources.mandmdirect.com%2FImages%2F_default%2Fn%2Fk%2F1%2Fnk11865_1_large.jpg&feedId=2606&k=524d4a92cc993cc77664e335b45a5390083eac97,8.95,M and M Direct IE,GBP8.95,Nike,,11.95,Mens Accessories,3671225077,NK11865,https://resources.mandmdirect.com/Images/_default/n/k/1/nk11865_1_large.jpg,Mens|Accessories|Scarves
https://www.awin1.com/pclick.php?p=5784978119&a=305691&m=2606,Nike lace-up mid cut trainers with Flyknit fabric to allow a natural snug fit that flexes with every movement and a one-piece construction,Nike Mens Lunarepic Flyknit Shield Trainers Black/Ocean Fog/Thunder Blue/Sail,https://images2.productserve.com/?w=200&h=200&bg=white&trim=5&t=letterbox&url=ssl%3Aresources.mandmdirect.com%2FImages%2F_default%2Fn%2Fk%2F1%2Fnk12148_1_large.jpg&feedId=2606&k=4f217f00eab769aa88fd3dae35d2e661db1f87cd,95.95,M and M Direct IE,GBP95.95,Nike,,203.95,Mens Footwear,5784978119,NK12148,https://resources.mandmdirect.com/Images/_default/n/k/1/nk12148_1_large.jpg,Mens|Trainers|Trainers
https://www.awin1.com/pclick.php?p=5784978121&a=305691&m=2606,Nike lace-up mid cut trainers with Flyknit fabric to allow a natural snug fit that flexes with every movement and a one-piece construction.,Nike Mens Lunarepic Flyknit Shield Trainers White/Black/Sail/Pale Grey,https://images2.productserve.com/?w=200&h=200&bg=white&trim=5&t=letterbox&url=ssl%3Aresources.mandmdirect.com%2FImages%2F_default%2Fn%2Fk%2F1%2Fnk12149_1_large.jpg&feedId=2606&k=14202902e3514254cce1cce12b5891dcd0119a23,91.95,M and M Direct IE,GBP91.95,Nike,,203.95,Mens Footwear,5784978121,NK12149,https://resources.mandmdirect.com/Images/_default/n/k/1/nk12149_1_large.jpg,Mens|Trainers|Trainers
https://www.awin1.com/pclick.php?p=3741090227&a=305691&m=2606,Nike brushback fleece over head hoody.,Nike Mens Fundamental Fleece Hoody Medium Grey Heather,https://images2.productserve.com/?w=200&h=200&bg=white&trim=5&t=letterbox&url=ssl%3Aresources.mandmdirect.com%2FImages%2F_default%2Fn%2Fk%2F1%2Fnk11964_1_large.jpg&feedId=2606&k=6e9dde9907f2dd9fa740f35459e6ee2da1faae3f,35.95,M and M Direct IE,GBP35.95,Nike,,51.95,Mens Clothing,3741090227,NK11964,https://resources.mandmdirect.com/Images/_default/n/k/1/nk11964_1_large.jpg,Mens|Hoodies And Sweatshirts|OTH Hoody
https://www.awin1.com/pclick.php?p=3741090229&a=305691&m=2606,Nike brushback fleece jersey cuffed sweat pants.,Nike Mens Fundamentals Cuffed Fleece Sweat Pants Medium Grey Heather,https://images2.productserve.com/?w=200&h=200&bg=white&trim=5&t=letterbox&url=ssl%3Aresources.mandmdirect.com%2FImages%2F_default%2Fn%2Fk%2F1%2Fnk11967_1_large.jpg&feedId=2606&k=d5e26a0c46084220bf3719e6360e0a12e12ae248,29.95,M and M Direct IE,GBP29.95,Nike,,41.95,Mens Sportswear,3741090229,NK11967,https://resources.mandmdirect.com/Images/_default/n/k/1/nk11967_1_large.jpg,Mens|Joggers|Joggers
https://www.awin1.com/pclick.php?p=3741090231&a=305691&m=2606,Nike brushback fleece cuffed sweat pants.,Nike Mens Fundamentals Cuffed Fleece Sweat Pants Black,https://images2.productserve.com/?w=200&h=200&bg=white&trim=5&t=letterbox&url=ssl%3Aresources.mandmdirect.com%2FImages%2F_default%2Fn%2Fk%2F1%2Fnk11966_1_large.jpg&feedId=2606&k=7957c1948065af5322d4df8c96260f5d92aaafc5,29.95,M and M Direct IE,GBP29.95,Nike,,41.95,Mens Sportswear,3741090231,NK11966,https://resources.mandmdirect.com/Images/_default/n/k/1/nk11966_1_large.jpg,Mens|Joggers|Joggers
https://www.awin1.com/pclick.php?p=3741090235&a=305691&m=2606,Nike brushback fleece cuffed sweatpants.,Nike Mens Fundamentals Cuffed Fleece Sweat Pants Navy,https://images2.productserve.com/?w=200&h=200&bg=white&trim=5&t=letterbox&url=ssl%3Aresources.mandmdirect.com%2FImages%2F_default%2Fn%2Fk%2F1%2Fnk11968_1_large.jpg&feedId=2606&k=4edf7c2b2f1e2a2580c3772b58da0e21a2df6b1a,29.95,M and M Direct IE,GBP29.95,Nike,,41.95,Mens Sportswear,3741090235,NK11968,https://resources.mandmdirect.com/Images/_default/n/k/1/nk11968_1_large.jpg,Mens|Joggers|Joggers
https://www.awin1.com/pclick.php?p=10204057029&a=305691&m=2606,Nike Zoom Rev basketball trainers with Nike Zoom Air Unit to which provides responsive impact protection. 852422011,Nike Mens Zoom Rev Trainers Cool Grey/Dark Grey/White,https://images2.productserve.com/?w=200&h=200&bg=white&trim=5&t=letterbox&url=ssl%3Aresources.mandmdirect.com%2FImages%2F_default%2Fn%2Fk%2F1%2Fnk12158_1_large.jpg&feedId=2606&k=c98e6f30ba22ba419f8190dcfd2f9161739127de,71.95,M and M Direct IE,GBP71.95,Nike,,107.95,Mens Footwear,10204057029,NK12158,https://resources.mandmdirect.com/Images/_default/n/k/1/nk12158_1_large.jpg,Mens|Trainers|Trainers
https://www.awin1.com/pclick.php?p=10752978405&a=305691&m=2606,Nike lace-up trainers featuring sleek details and visible Max Air for all-day comfort.,Nike Womens Air Max Jewell Metallic Gold Qs Trainers Metallic Gold/Metallic Gold/Varsity Red,https://images2.productserve.com/?w=200&h=200&bg=white&trim=5&t=letterbox&url=ssl%3Aresources.mandmdirect.com%2FImages%2F_default%2Fn%2Fk%2F1%2Fnk12213_1_large.jpg&feedId=2606&k=2726de860e4a701e5c18d821268b493cdabb8688,83.95,M and M Direct IE,GBP83.95,Nike,,107.95,Womens Footwear,10752978405,NK12213,https://resources.mandmdirect.com/Images/_default/n/k/1/nk12213_1_large.jpg,Womens|Trainers|Trainers
https://www.awin1.com/pclick.php?p=10752978407&a=305691&m=2606,Nike featherweight form-fitting trainers with a breathable Flyknit upper which wraps your foot for a flexable  snug fit.,Nike Womens Air Sock Racer Ultra Flyknit Trainers Racer Pink/Black/White,https://images2.productserve.com/?w=200&h=200&bg=white&trim=5&t=letterbox&url=ssl%3Aresources.mandmdirect.com%2FImages%2F_default%2Fn%2Fk%2F1%2Fnk12236_1_large.jpg&feedId=2606&k=eedec37dd7c5033f25fa9c050c8346d8822c1484,65.95,M and M Direct IE,GBP65.95,Nike,,113.95,Womens Footwear,10752978407,NK12236,https://resources.mandmdirect.com/Images/_default/n/k/1/nk12236_1_large.jpg,Womens|Trainers|Trainers
